{
  "schema_version": "misa.local_distillation_source.v1",
  "source_id": "route-source-03",
  "source_kind": "chat_window",
  "channel": "local",
  "created_at": "2026-05-13T00:02:00.000Z",
  "local_only": true,
  "uses_zilliz_proxy": false,
  "vector_lookup_required": false,
  "raw_window_default": false,
  "redaction_status": "redacted",
  "redaction_note": "Synthetic compact fixture for route-sensitive tournament calibration.",
  "summary": "Third compact fixture keeps route diversity without historical file names.",
  "setpoint": "preserve route-specific winners without importing historical run inventory",
  "evidence_count": 5,
  "outcome": "success",
  "risk_level": "medium",
  "source_refs": ["fixture:route-source-03"],
  "signals": [
    "explicit_user_boundary",
    "public_posting_boundary",
    "single_failure",
    "avoid_overreaction",
    "reusable_workflow",
    "repeated_failure_pattern",
    "stable_user_preference",
    "stable_project_fact"
  ],
  "artifact_evidence": {
    "injected": [],
    "read": ["fixture:route-source-03"],
    "modified": [],
    "tool_errors": ["fixture:retry-timeout"]
  },
  "turns": [
    {
      "speaker": "fixture-policy",
      "ref": "fixture:route-source-03:policy",
      "text": "Do not let public Farcaster reply behavior bypass approval."
    },
    {
      "speaker": "fixture-damping",
      "ref": "fixture:route-source-03:damping",
      "text": "One single transient failure should not trigger overreaction."
    },
    {
      "speaker": "fixture-skill",
      "ref": "fixture:route-source-03:skill",
      "text": "Reusable workflow steps should run validate, preflight, and simulate before reuse."
    },
    {
      "speaker": "fixture-case",
      "ref": "fixture:route-source-03:case",
      "text": "Repeated timeout failure error retry evidence should be recorded as a case."
    },
    {
      "speaker": "fixture-memory",
      "ref": "fixture:route-source-03:memory",
      "text": "Stable project facts include local repo, VPS, GitHub, window, and distill context."
    }
  ]
}
