{
  "schema_version": "misa.local_distillation_source.v1",
  "source_id": "hist-20-2026-04-26t13-46-47-50tb-misa-discord-bridge-owner-mode-and-memory-retrieval-fix",
  "source_kind": "farcaster_audit",
  "channel": "discord",
  "created_at": "2026-05-11T08:19:00.000Z",
  "local_only": true,
  "uses_zilliz_proxy": false,
  "vector_lookup_required": false,
  "raw_window_default": false,
  "redaction_status": "redacted",
  "redaction_note": "Synthetic deterministic fixture for local and VPS tests; no raw conversation or credential material.",
  "summary": "Synthetic fixture for hist-20-2026-04-26t13-46-47-50tb-misa-discord-bridge-owner-mode-and-memory-retrieval-fix covering single_failure, explicit_user_boundary, reusable_workflow, stable_user_preference, stable_project_fact, farcaster_reply_success.",
  "setpoint": "hold weak or single-sample evidence to avoid overreaction",
  "evidence_count": 4,
  "outcome": "partial",
  "risk_level": "high",
  "source_refs": [
    "fixture:hist-20-2026-04-26t13-46-47-50tb-misa-discord-bridge-owner-mode-and-memory-retrieval-fix"
  ],
  "signals": [
    "single_failure",
    "explicit_user_boundary",
    "reusable_workflow",
    "stable_user_preference",
    "stable_project_fact",
    "farcaster_reply_success"
  ],
  "artifact_evidence": {
    "injected": [],
    "read": [
      "fixture:hist-20-2026-04-26t13-46-47-50tb-misa-discord-bridge-owner-mode-and-memory-retrieval-fix"
    ],
    "modified": [],
    "tool_errors": [
      "fixture:tool-error"
    ]
  },
  "turns": [
    {
      "speaker": "fixture-single_failure",
      "ref": "fixture:hist-20-2026-04-26t13-46-47-50tb-misa-discord-bridge-owner-mode-and-memory-retrieval-fix:turn:01",
      "text": "One single transient failure should stay damped before any broader learning change."
    },
    {
      "speaker": "fixture-explicit_user_boundary",
      "ref": "fixture:hist-20-2026-04-26t13-46-47-50tb-misa-discord-bridge-owner-mode-and-memory-retrieval-fix:turn:02",
      "text": "Do not publish, deploy, or write durable state without approval."
    },
    {
      "speaker": "fixture-reusable_workflow",
      "ref": "fixture:hist-20-2026-04-26t13-46-47-50tb-misa-discord-bridge-owner-mode-and-memory-retrieval-fix:turn:03",
      "text": "Workflow template steps validate preflight simulate and verify before reuse."
    },
    {
      "speaker": "fixture-stable_user_preference",
      "ref": "fixture:hist-20-2026-04-26t13-46-47-50tb-misa-discord-bridge-owner-mode-and-memory-retrieval-fix:turn:04",
      "text": "User prefers concise evidence-first recovery and explicit approval boundaries."
    },
    {
      "speaker": "fixture-stable_project_fact",
      "ref": "fixture:hist-20-2026-04-26t13-46-47-50tb-misa-discord-bridge-owner-mode-and-memory-retrieval-fix:turn:05",
      "text": "Local repo VPS GitHub window distill facts are stable project context."
    },
    {
      "speaker": "fixture-farcaster_reply_success",
      "ref": "fixture:hist-20-2026-04-26t13-46-47-50tb-misa-discord-bridge-owner-mode-and-memory-retrieval-fix:turn:06",
      "text": "Useful reply success can be reviewed locally without live posting."
    }
  ]
}
