{
  "schema_version": "misa.local_distillation_source.v1",
  "source_id": "judge-source-01",
  "source_kind": "chat_window",
  "channel": "local",
  "created_at": "2026-05-13T01:00:00.000Z",
  "local_only": true,
  "uses_zilliz_proxy": false,
  "vector_lookup_required": false,
  "raw_window_default": false,
  "redaction_status": "redacted",
  "redaction_note": "Synthetic compact fixture for near-threshold judge calibration.",
  "summary": "Near-threshold fixture with policy, skill, case, and memory pressure.",
  "setpoint": "surface optional critique value without spending an automatic LLM call",
  "evidence_count": 4,
  "outcome": "success",
  "risk_level": "medium",
  "source_refs": ["fixture:judge-source-01"],
  "signals": [
    "explicit_user_boundary",
    "public_posting_boundary",
    "reusable_workflow",
    "repeated_failure_pattern",
    "stable_user_preference",
    "stable_project_fact"
  ],
  "artifact_evidence": {
    "injected": [],
    "read": ["fixture:judge-source-01"],
    "modified": [],
    "tool_errors": ["fixture:retry-timeout"]
  },
  "turns": [
    {
      "speaker": "fixture-policy",
      "ref": "fixture:judge-source-01:policy",
      "text": "Do not publish a public Farcaster reply without approval."
    },
    {
      "speaker": "fixture-skill",
      "ref": "fixture:judge-source-01:skill",
      "text": "A reusable workflow should run validate and preflight before reuse."
    },
    {
      "speaker": "fixture-case",
      "ref": "fixture:judge-source-01:case",
      "text": "Repeated timeout failure error retry should stay as local case evidence."
    },
    {
      "speaker": "fixture-memory",
      "ref": "fixture:judge-source-01:memory",
      "text": "User prefers short evidence-first summaries for the local repo and VPS context."
    }
  ]
}
