{
  "schema_version": "misa.local_distillation_source.v1",
  "source_id": "hist-18-2026-04-26t17-05-01-gtos-misa-hermes-session-distiller-retrieval-miss-handoff",
  "source_kind": "failure_log",
  "channel": "local",
  "created_at": "2026-05-11T08:17:00.000Z",
  "local_only": true,
  "uses_zilliz_proxy": false,
  "vector_lookup_required": false,
  "raw_window_default": false,
  "redaction_status": "redacted",
  "redaction_note": "Synthetic deterministic fixture for local and VPS tests; no raw conversation or credential material.",
  "summary": "Synthetic fixture for hist-18-2026-04-26t17-05-01-gtos-misa-hermes-session-distiller-retrieval-miss-handoff covering single_failure, repeated_failure_pattern, reusable_workflow, stable_user_preference, stable_project_fact.",
  "setpoint": "hold weak or single-sample evidence to avoid overreaction",
  "evidence_count": 4,
  "outcome": "partial",
  "risk_level": "high",
  "source_refs": [
    "fixture:hist-18-2026-04-26t17-05-01-gtos-misa-hermes-session-distiller-retrieval-miss-handoff"
  ],
  "signals": [
    "single_failure",
    "repeated_failure_pattern",
    "reusable_workflow",
    "stable_user_preference",
    "stable_project_fact"
  ],
  "artifact_evidence": {
    "injected": [],
    "read": [
      "fixture:hist-18-2026-04-26t17-05-01-gtos-misa-hermes-session-distiller-retrieval-miss-handoff"
    ],
    "modified": [],
    "tool_errors": []
  },
  "turns": [
    {
      "speaker": "fixture-single_failure",
      "ref": "fixture:hist-18-2026-04-26t17-05-01-gtos-misa-hermes-session-distiller-retrieval-miss-handoff:turn:01",
      "text": "One single transient failure should stay damped before any broader learning change."
    },
    {
      "speaker": "fixture-repeated_failure_pattern",
      "ref": "fixture:hist-18-2026-04-26t17-05-01-gtos-misa-hermes-session-distiller-retrieval-miss-handoff:turn:02",
      "text": "Repeated timeout failure error retry pattern should become a local case before runtime changes."
    },
    {
      "speaker": "fixture-reusable_workflow",
      "ref": "fixture:hist-18-2026-04-26t17-05-01-gtos-misa-hermes-session-distiller-retrieval-miss-handoff:turn:03",
      "text": "Workflow template steps validate preflight simulate and verify before reuse."
    },
    {
      "speaker": "fixture-stable_user_preference",
      "ref": "fixture:hist-18-2026-04-26t17-05-01-gtos-misa-hermes-session-distiller-retrieval-miss-handoff:turn:04",
      "text": "User prefers concise evidence-first recovery and explicit approval boundaries."
    },
    {
      "speaker": "fixture-stable_project_fact",
      "ref": "fixture:hist-18-2026-04-26t17-05-01-gtos-misa-hermes-session-distiller-retrieval-miss-handoff:turn:05",
      "text": "Local repo VPS GitHub window distill facts are stable project context."
    }
  ]
}
