{
  "schema_version": "misa.local_distillation_source.v1",
  "source_id": "atomic-skill-identity-fast-path",
  "source_kind": "chat_window",
  "channel": "local",
  "created_at": "2026-05-13T00:00:00.000Z",
  "local_only": true,
  "uses_zilliz_proxy": false,
  "vector_lookup_required": false,
  "raw_window_default": false,
  "redaction_status": "redacted",
  "redaction_note": "Synthetic atomic fixture for judge calibration; no raw conversation or credential material.",
  "summary": "Synthetic atomic fixture for atomic-skill-identity-fast-path.",
  "setpoint": "keep the deterministic gate calibrated before optional critique",
  "evidence_count": 3,
  "outcome": "success",
  "risk_level": "low",
  "source_refs": [
    "fixture:atomic-skill-identity-fast-path"
  ],
  "signals": [
    "reusable_workflow"
  ],
  "artifact_evidence": {
    "injected": [],
    "read": [
      "fixture:atomic-skill-identity-fast-path"
    ],
    "modified": [],
    "tool_errors": []
  },
  "turns": [
    {
      "speaker": "fixture-reusable_workflow",
      "ref": "fixture:atomic-skill-identity-fast-path:turn:01",
      "text": "Workflow template steps validate preflight simulate verify before reuse."
    }
  ]
}
