{
  "schema_version": "misa.local_distillation_source.v1",
  "source_id": "hist-16-2026-04-27t16-24-44-0fve-farcaster-autonomous-operator-v2-local-pilot-plus-hardenings",
  "source_kind": "farcaster_audit",
  "channel": "farcaster",
  "created_at": "2026-05-11T08:15:00.000Z",
  "local_only": true,
  "uses_zilliz_proxy": false,
  "vector_lookup_required": false,
  "raw_window_default": false,
  "redaction_status": "redacted",
  "redaction_note": "Synthetic deterministic fixture for local and VPS tests; no raw conversation or credential material.",
  "summary": "Synthetic fixture for hist-16-2026-04-27t16-24-44-0fve-farcaster-autonomous-operator-v2-local-pilot-plus-hardenings covering single_failure, explicit_user_boundary, public_posting_boundary, farcaster_public_memory_risk, reusable_workflow, stable_user_preference, stable_project_fact, farcaster_reply_success.",
  "setpoint": "hold weak or single-sample evidence to avoid overreaction",
  "evidence_count": 4,
  "outcome": "partial",
  "risk_level": "high",
  "source_refs": [
    "fixture:hist-16-2026-04-27t16-24-44-0fve-farcaster-autonomous-operator-v2-local-pilot-plus-hardenings"
  ],
  "signals": [
    "single_failure",
    "explicit_user_boundary",
    "public_posting_boundary",
    "farcaster_public_memory_risk",
    "reusable_workflow",
    "stable_user_preference",
    "stable_project_fact",
    "farcaster_reply_success"
  ],
  "artifact_evidence": {
    "injected": [],
    "read": [
      "fixture:hist-16-2026-04-27t16-24-44-0fve-farcaster-autonomous-operator-v2-local-pilot-plus-hardenings"
    ],
    "modified": [],
    "tool_errors": []
  },
  "turns": [
    {
      "speaker": "fixture-single_failure",
      "ref": "fixture:hist-16-2026-04-27t16-24-44-0fve-farcaster-autonomous-operator-v2-local-pilot-plus-hardenings:turn:01",
      "text": "One single transient failure should stay damped before any broader learning change."
    },
    {
      "speaker": "fixture-explicit_user_boundary",
      "ref": "fixture:hist-16-2026-04-27t16-24-44-0fve-farcaster-autonomous-operator-v2-local-pilot-plus-hardenings:turn:02",
      "text": "Do not publish, deploy, or write durable state without approval."
    },
    {
      "speaker": "fixture-public_posting_boundary",
      "ref": "fixture:hist-16-2026-04-27t16-24-44-0fve-farcaster-autonomous-operator-v2-local-pilot-plus-hardenings:turn:03",
      "text": "Farcaster public reply and public post behavior must stay behind approval."
    },
    {
      "speaker": "fixture-farcaster_public_memory_risk",
      "ref": "fixture:hist-16-2026-04-27t16-24-44-0fve-farcaster-autonomous-operator-v2-local-pilot-plus-hardenings:turn:04",
      "text": "Public memory privacy and privacy leak risk should stay policy-bound."
    },
    {
      "speaker": "fixture-reusable_workflow",
      "ref": "fixture:hist-16-2026-04-27t16-24-44-0fve-farcaster-autonomous-operator-v2-local-pilot-plus-hardenings:turn:05",
      "text": "Workflow template steps validate preflight simulate and verify before reuse."
    },
    {
      "speaker": "fixture-stable_user_preference",
      "ref": "fixture:hist-16-2026-04-27t16-24-44-0fve-farcaster-autonomous-operator-v2-local-pilot-plus-hardenings:turn:06",
      "text": "User prefers concise evidence-first recovery and explicit approval boundaries."
    },
    {
      "speaker": "fixture-stable_project_fact",
      "ref": "fixture:hist-16-2026-04-27t16-24-44-0fve-farcaster-autonomous-operator-v2-local-pilot-plus-hardenings:turn:07",
      "text": "Local repo VPS GitHub window distill facts are stable project context."
    },
    {
      "speaker": "fixture-farcaster_reply_success",
      "ref": "fixture:hist-16-2026-04-27t16-24-44-0fve-farcaster-autonomous-operator-v2-local-pilot-plus-hardenings:turn:08",
      "text": "Useful reply success can be reviewed locally without live posting."
    }
  ]
}
