{
  "schema_version": "misa.local_distillation_source.v1",
  "source_id": "hist-04-2026-05-09t21-52-34-bozk-misa-cybernetic-v0-6-local-github-landing-and-v0-4-vps-insta",
  "source_kind": "farcaster_audit",
  "channel": "discord",
  "created_at": "2026-05-11T08:03:00.000Z",
  "local_only": true,
  "uses_zilliz_proxy": false,
  "vector_lookup_required": false,
  "raw_window_default": false,
  "redaction_status": "redacted",
  "redaction_note": "Synthetic deterministic fixture for local and VPS tests; no raw conversation or credential material.",
  "summary": "Synthetic fixture for hist-04-2026-05-09t21-52-34-bozk-misa-cybernetic-v0-6-local-github-landing-and-v0-4-vps-insta covering explicit_user_boundary, public_posting_boundary, reusable_workflow, stable_user_preference, stable_project_fact, farcaster_reply_success.",
  "setpoint": "keep this historical lesson behind policy or approval boundaries before runtime changes",
  "evidence_count": 4,
  "outcome": "partial",
  "risk_level": "high",
  "source_refs": [
    "fixture:hist-04-2026-05-09t21-52-34-bozk-misa-cybernetic-v0-6-local-github-landing-and-v0-4-vps-insta"
  ],
  "signals": [
    "explicit_user_boundary",
    "public_posting_boundary",
    "reusable_workflow",
    "stable_user_preference",
    "stable_project_fact",
    "farcaster_reply_success"
  ],
  "artifact_evidence": {
    "injected": [],
    "read": [
      "fixture:hist-04-2026-05-09t21-52-34-bozk-misa-cybernetic-v0-6-local-github-landing-and-v0-4-vps-insta"
    ],
    "modified": [],
    "tool_errors": [
      "fixture:tool-error"
    ]
  },
  "turns": [
    {
      "speaker": "fixture-explicit_user_boundary",
      "ref": "fixture:hist-04-2026-05-09t21-52-34-bozk-misa-cybernetic-v0-6-local-github-landing-and-v0-4-vps-insta:turn:01",
      "text": "Do not publish, deploy, or write durable state without approval."
    },
    {
      "speaker": "fixture-public_posting_boundary",
      "ref": "fixture:hist-04-2026-05-09t21-52-34-bozk-misa-cybernetic-v0-6-local-github-landing-and-v0-4-vps-insta:turn:02",
      "text": "Farcaster public reply and public post behavior must stay behind approval."
    },
    {
      "speaker": "fixture-reusable_workflow",
      "ref": "fixture:hist-04-2026-05-09t21-52-34-bozk-misa-cybernetic-v0-6-local-github-landing-and-v0-4-vps-insta:turn:03",
      "text": "Workflow template steps validate preflight simulate and verify before reuse."
    },
    {
      "speaker": "fixture-stable_user_preference",
      "ref": "fixture:hist-04-2026-05-09t21-52-34-bozk-misa-cybernetic-v0-6-local-github-landing-and-v0-4-vps-insta:turn:04",
      "text": "User prefers concise evidence-first recovery and explicit approval boundaries."
    },
    {
      "speaker": "fixture-stable_project_fact",
      "ref": "fixture:hist-04-2026-05-09t21-52-34-bozk-misa-cybernetic-v0-6-local-github-landing-and-v0-4-vps-insta:turn:05",
      "text": "Local repo VPS GitHub window distill facts are stable project context."
    },
    {
      "speaker": "fixture-farcaster_reply_success",
      "ref": "fixture:hist-04-2026-05-09t21-52-34-bozk-misa-cybernetic-v0-6-local-github-landing-and-v0-4-vps-insta:turn:06",
      "text": "Useful reply success can be reviewed locally without live posting."
    }
  ]
}
