{
  "schema_version": "misa.local_distillation_source.v1",
  "source_id": "hist-14-2026-05-08t04-32-14-8ydn-farcaster-v2-soft-judge-profile-writer-webhook-next-step",
  "source_kind": "farcaster_audit",
  "channel": "farcaster",
  "created_at": "2026-05-11T08:13:00.000Z",
  "local_only": true,
  "uses_zilliz_proxy": false,
  "vector_lookup_required": false,
  "raw_window_default": false,
  "redaction_status": "redacted",
  "redaction_note": "Synthetic deterministic fixture for local and VPS tests; no raw conversation or credential material.",
  "summary": "Synthetic fixture for hist-14-2026-05-08t04-32-14-8ydn-farcaster-v2-soft-judge-profile-writer-webhook-next-step covering single_failure, public_posting_boundary, reusable_workflow, stable_user_preference, stable_project_fact, farcaster_reply_success.",
  "setpoint": "hold weak or single-sample evidence to avoid overreaction",
  "evidence_count": 4,
  "outcome": "partial",
  "risk_level": "high",
  "source_refs": [
    "fixture:hist-14-2026-05-08t04-32-14-8ydn-farcaster-v2-soft-judge-profile-writer-webhook-next-step"
  ],
  "signals": [
    "single_failure",
    "public_posting_boundary",
    "reusable_workflow",
    "stable_user_preference",
    "stable_project_fact",
    "farcaster_reply_success"
  ],
  "artifact_evidence": {
    "injected": [],
    "read": [
      "fixture:hist-14-2026-05-08t04-32-14-8ydn-farcaster-v2-soft-judge-profile-writer-webhook-next-step"
    ],
    "modified": [],
    "tool_errors": []
  },
  "turns": [
    {
      "speaker": "fixture-single_failure",
      "ref": "fixture:hist-14-2026-05-08t04-32-14-8ydn-farcaster-v2-soft-judge-profile-writer-webhook-next-step:turn:01",
      "text": "One single transient failure should stay damped before any broader learning change."
    },
    {
      "speaker": "fixture-public_posting_boundary",
      "ref": "fixture:hist-14-2026-05-08t04-32-14-8ydn-farcaster-v2-soft-judge-profile-writer-webhook-next-step:turn:02",
      "text": "Farcaster public reply and public post behavior must stay behind approval."
    },
    {
      "speaker": "fixture-reusable_workflow",
      "ref": "fixture:hist-14-2026-05-08t04-32-14-8ydn-farcaster-v2-soft-judge-profile-writer-webhook-next-step:turn:03",
      "text": "Workflow template steps validate preflight simulate and verify before reuse."
    },
    {
      "speaker": "fixture-stable_user_preference",
      "ref": "fixture:hist-14-2026-05-08t04-32-14-8ydn-farcaster-v2-soft-judge-profile-writer-webhook-next-step:turn:04",
      "text": "User prefers concise evidence-first recovery and explicit approval boundaries."
    },
    {
      "speaker": "fixture-stable_project_fact",
      "ref": "fixture:hist-14-2026-05-08t04-32-14-8ydn-farcaster-v2-soft-judge-profile-writer-webhook-next-step:turn:05",
      "text": "Local repo VPS GitHub window distill facts are stable project context."
    },
    {
      "speaker": "fixture-farcaster_reply_success",
      "ref": "fixture:hist-14-2026-05-08t04-32-14-8ydn-farcaster-v2-soft-judge-profile-writer-webhook-next-step:turn:06",
      "text": "Useful reply success can be reviewed locally without live posting."
    }
  ]
}
